<?xml version="1.0" encoding="utf-8"?>
<tc:TranslatorConfiguration
	xmlns:tc="http://www.lti.pcs.usp.br/TranslatorConfiguration" xmlns:xsi="http://www.w3.org/2001/XMLSchema-instance"
	xsi:schemaLocation="http://www.lti.pcs.usp.br/TranslatorConfiguration translatorconfiguration.xsd">

	<id>liarAgent</id>
	<urlMapperServer>http://localhost:8080/axis2/services/MapperServerWebService</urlMapperServer>
	<ontNativeName>LIAR</ontNativeName>
	<ontNativeVersion>1</ontNativeVersion>
	<ontInterchangeName>FORE</ontInterchangeName>
	<ontInterchangeVersion>1</ontInterchangeVersion>
	<mapperClientClass>otservices.translator.mapperserverclient.ws.MapperClientWebService</mapperClientClass>
	<internalLanguageName>SPARQL</internalLanguageName>
	<internalLanguageClass>otservices.translator.language.sparql.SPARQLFactory</internalLanguageClass>
	<inputTranslationStrategyClass>otservices.translator.strategy.impl.HeuristicStrategy</inputTranslationStrategyClass>
	<outputTranslationStrategyClass>otservices.translator.strategy.impl.ZeroInputNAll</outputTranslationStrategyClass>
	<valueTransformationConcept>ReputationValueByLiar</valueTransformationConcept>
	<valueTransformationClass>otservices.translator.valuetransformation.art.LIARFOREValueTransformation</valueTransformationClass>
	<reputationReasonerClass>otservices.translator.reputationreasoner.impl.liar.LIARReputationReasoner</reputationReasonerClass>
</tc:TranslatorConfiguration>